{
  "id": "wp-a1c001",
  "kind": "contract",
  "state": "accepted",
  "role": "architect",
  "ownsPaths": [
    "packages/contracts/"
  ],
  "readsPaths": [
    "docs/"
  ],
  "deps": [],
  "acceptance": {
    "kind": "schema",
    "predicate": "pnpm gen:check && pnpm typecheck",
    "authoredBy": "qa"
  },
  "budget": {
    "currency": "CNY",
    "limitCny": 3,
    "spentCny": 0.91,
    "degradationChain": [
      "drop_semantic_memory"
    ]
  },
  "routing": {
    "model": "claude-opus-5",
    "effort": "high"
  },
  "attempts": 1,
  "evidence": [
    "ev-001"
  ],
  "provenance": {
    "createdBy": "planner",
    "createdAt": "2026-08-02T09:02:00.000Z"
  }
}
