{
  "id": "wp-5fe438a743b1",
  "kind": "impl",
  "state": "accepted",
  "role": "coder",
  "ownsPaths": [
    "workspace/"
  ],
  "readsPaths": [],
  "deps": [],
  "acceptance": {
    "kind": "manual",
    "predicate": "operator-review: 需求由操作者直接提交，未附机器可判定的验收标准；此条为引擎在 Intake 缺位时生成的占位验收，需人工判定",
    "authoredBy": "qa"
  },
  "budget": {
    "currency": "CNY",
    "limitCny": 1.0,
    "spentCny": 0.0,
    "degradationChain": [
      "drop_semantic"
    ]
  },
  "routing": {
    "model": "qwen-coder-plus-1106",
    "effort": "medium"
  },
  "attempts": 1,
  "evidence": [
    "file:model/result.json"
  ],
  "provenance": {
    "createdBy": "intake",
    "createdAt": "2026-08-11T02:46:18.304Z"
  }
}
