{
  "id": "wp-f6h006",
  "kind": "fix",
  "state": "pending",
  "role": "coder",
  "ownsPaths": [
    "src/auth/session.ts"
  ],
  "readsPaths": [
    "packages/contracts/",
    "tests/"
  ],
  "deps": [
    "wp-b2d002"
  ],
  "acceptance": {
    "kind": "manual",
    "predicate": "operator_approval:contract_adjacent_change",
    "authoredBy": "architect"
  },
  "budget": {
    "currency": "CNY",
    "limitCny": 1.5,
    "spentCny": 0,
    "degradationChain": [
      "drop_semantic_memory"
    ]
  },
  "routing": {
    "model": "claude-opus-5",
    "effort": "high"
  },
  "attempts": 0,
  "evidence": [],
  "provenance": {
    "createdBy": "helper",
    "createdAt": "2026-08-02T10:47:30.000Z",
    "parent": "wp-b2d002"
  }
}
