{
  "id": "wp-c3e003",
  "kind": "review",
  "state": "running",
  "role": "reviewer",
  "ownsPaths": ["src/api/"],
  "readsPaths": ["packages/contracts/", "tests/"],
  "deps": ["wp-a1c001"],
  "acceptance": {
    "kind": "test",
    "predicate": "pnpm vitest run tests/api --reporter=json",
    "authoredBy": "qa"
  },
  "budget": {
    "currency": "USD",
    "limitUsd": 3,
    "spentUsd": 2.05,
    "degradationChain": ["drop_semantic_memory", "shrink_review_context"]
  },
  "routing": {
    "model": "claude-sonnet-5",
    "effort": "high"
  },
  "attempts": 1,
  "evidence": [],
  "provenance": {
    "createdBy": "planner",
    "createdAt": "2026-08-02T09:12:00.000Z",
    "parent": "wp-a1c001"
  }
}
